{
  "$schema": "https://json-schema.org/draft/2020-12/schema",
  "title": "Reviewer verdict on one document",
  "type": "object",
  "additionalProperties": false,
  "required": [
    "document_id",
    "reviewer",
    "overall_vote",
    "confidence",
    "rationale",
    "findings"
  ],
  "properties": {
    "document_id": {
      "type": "string"
    },
    "reviewer": {
      "type": "string"
    },
    "overall_vote": {
      "description": "Is the document sound as written?",
      "enum": [
        "sound",
        "sound-with-required-changes",
        "unsound",
        "abstain"
      ]
    },
    "confidence": {
      "type": "number",
      "minimum": 0,
      "maximum": 1
    },
    "rationale": {
      "type": "string"
    },
    "findings": {
      "type": "array",
      "description": "Every objection. An empty array is a valid and meaningful answer.",
      "items": {
        "type": "object",
        "additionalProperties": false,
        "required": [
          "section",
          "severity",
          "problem",
          "what_would_fix_it",
          "quote"
        ],
        "properties": {
          "section": {
            "type": "string",
            "description": "The section number or heading the finding is against. A finding that cannot name one is downgraded to minor, because an objection that does not attach to text cannot be acted on."
          },
          "severity": {
            "description": "fatal: the document cannot proceed as written. major: a stated conclusion would be wrong or unsupported. minor: it would be better changed. Anything at major or above must state what would fix it or it is downgraded.",
            "enum": [
              "fatal",
              "major",
              "minor"
            ]
          },
          "problem": {
            "type": "string"
          },
          "what_would_fix_it": {
            "type": [
              "string",
              "null"
            ],
            "description": "Required for fatal and major. A finding at those levels with null here is downgraded to minor by the adjudication rule."
          },
          "quote": {
            "type": [
              "string",
              "null"
            ],
            "description": "Verbatim text from the document the finding is against, or from a cited source that contradicts it. Pass null when there is none; the key must be present because OpenAI structured output requires every property to be listed as required. A quote is what distinguishes an evidenced objection from an opinion."
          }
        }
      }
    }
  }
}